{
  "$comment": "由 packages/content-schema 產生，不要手改；執行 pnpm schemas:build 重新產生。",
  "$schema": "http://json-schema.org/draft-07/schema#",
  "type": "object",
  "properties": {
    "rev": {
      "$ref": "#/definitions/__schema0"
    },
    "revKind": {
      "$ref": "#/definitions/__schema1"
    },
    "status": {
      "$ref": "#/definitions/__schema2"
    },
    "supersededBy": {
      "$ref": "#/definitions/__schema3"
    },
    "retiredNote": {
      "$ref": "#/definitions/__schema4"
    },
    "authorNotes": {
      "$ref": "#/definitions/__schema7"
    },
    "updatedAt": {
      "$ref": "#/definitions/__schema8"
    },
    "id": {
      "$ref": "#/definitions/__schema9"
    },
    "category": {
      "$ref": "#/definitions/__schema10"
    },
    "label": {
      "$ref": "#/definitions/LocalizedText"
    },
    "teacherLabel": {
      "$ref": "#/definitions/__schema11"
    },
    "currentTwLabel": {
      "$ref": "#/definitions/__schema12"
    },
    "ifrsEnglish": {
      "$ref": "#/definitions/__schema13"
    },
    "aliases": {
      "$ref": "#/definitions/__schema14"
    },
    "enUsVariant": {
      "$ref": "#/definitions/__schema15"
    },
    "flags": {
      "$ref": "#/definitions/__schema16"
    },
    "confidence": {
      "$ref": "#/definitions/__schema17"
    },
    "pendingRefs": {
      "$ref": "#/definitions/__schema18"
    },
    "ifrsBasis": {
      "$ref": "#/definitions/__schema19"
    },
    "note": {
      "$ref": "#/definitions/__schema20"
    },
    "definition": {
      "$ref": "#/definitions/LocalizedText"
    },
    "example": {
      "$ref": "#/definitions/__schema21"
    },
    "misconception": {
      "$ref": "#/definitions/__schema22"
    },
    "formula": {
      "$ref": "#/definitions/__schema23"
    },
    "ifrsNote": {
      "$ref": "#/definitions/__schema24"
    },
    "accountRef": {
      "$ref": "#/definitions/__schema25"
    },
    "ratioRef": {
      "$ref": "#/definitions/__schema26"
    },
    "related": {
      "$ref": "#/definitions/__schema27"
    },
    "labRefs": {
      "$ref": "#/definitions/__schema28"
    },
    "unlock": {
      "$ref": "#/definitions/__schema29"
    }
  },
  "required": [
    "rev",
    "revKind",
    "status",
    "id",
    "category",
    "label",
    "teacherLabel",
    "currentTwLabel",
    "ifrsEnglish",
    "aliases",
    "flags",
    "confidence",
    "pendingRefs",
    "definition"
  ],
  "additionalProperties": false,
  "definitions": {
    "__schema0": {
      "type": "integer",
      "minimum": 1,
      "maximum": 9007199254740991
    },
    "__schema1": {
      "type": "string",
      "enum": [
        "text",
        "answer"
      ]
    },
    "__schema2": {
      "type": "string",
      "enum": [
        "draft",
        "published",
        "retired"
      ]
    },
    "__schema3": {
      "type": "string"
    },
    "__schema4": {
      "allOf": [
        {
          "$ref": "#/definitions/LocalizedText"
        }
      ]
    },
    "LocalizedText": {
      "type": "object",
      "properties": {
        "zh-TW": {
          "$ref": "#/definitions/__schema5"
        },
        "en": {
          "$ref": "#/definitions/__schema6"
        }
      },
      "required": [
        "zh-TW"
      ],
      "additionalProperties": false
    },
    "__schema5": {
      "type": "string",
      "minLength": 1
    },
    "__schema6": {
      "type": "string",
      "minLength": 1
    },
    "__schema7": {
      "type": "string"
    },
    "__schema8": {
      "type": "string",
      "format": "date-time",
      "pattern": "^(?:(?:\\d\\d[2468][048]|\\d\\d[13579][26]|\\d\\d0[48]|[02468][048]00|[13579][26]00)-02-29|\\d{4}-(?:(?:0[13578]|1[02])-(?:0[1-9]|[12]\\d|3[01])|(?:0[469]|11)-(?:0[1-9]|[12]\\d|30)|(?:02)-(?:0[1-9]|1\\d|2[0-8])))T(?:(?:[01]\\d|2[0-3]):[0-5]\\d:[0-5]\\d(?:\\.\\d+)?(?:Z|([+-](?:[01]\\d|2[0-3]):[0-5]\\d)))$"
    },
    "__schema9": {
      "type": "string",
      "pattern": "^tm_[0123456789abcdefghjkmnpqrstvwxyz]{8}$"
    },
    "__schema10": {
      "type": "string",
      "enum": [
        "statement",
        "account",
        "ratio",
        "concept",
        "process",
        "other"
      ]
    },
    "__schema11": {
      "type": "string",
      "minLength": 1
    },
    "__schema12": {
      "anyOf": [
        {
          "type": "string",
          "minLength": 1
        },
        {
          "type": "null"
        }
      ]
    },
    "__schema13": {
      "anyOf": [
        {
          "type": "string",
          "minLength": 1
        },
        {
          "type": "null"
        }
      ]
    },
    "__schema14": {
      "type": "object",
      "properties": {
        "zh-TW": {
          "type": "array",
          "items": {
            "type": "string"
          }
        },
        "en": {
          "type": "array",
          "items": {
            "type": "string"
          }
        }
      },
      "required": [
        "zh-TW",
        "en"
      ],
      "additionalProperties": false
    },
    "__schema15": {
      "type": "string"
    },
    "__schema16": {
      "type": "array",
      "items": {
        "type": "string",
        "enum": [
          "japanese",
          "old_name",
          "typo_fixed",
          "unused",
          "not_ifrs_line",
          "ifrs_treatment_differs",
          "simplified"
        ]
      }
    },
    "__schema17": {
      "type": "string",
      "enum": [
        "high",
        "medium",
        "pending"
      ]
    },
    "__schema18": {
      "type": "array",
      "items": {
        "type": "string",
        "pattern": "^T\\d{2}$"
      }
    },
    "__schema19": {
      "type": "string"
    },
    "__schema20": {
      "allOf": [
        {
          "$ref": "#/definitions/LocalizedText"
        }
      ]
    },
    "__schema21": {
      "allOf": [
        {
          "$ref": "#/definitions/LocalizedText"
        }
      ]
    },
    "__schema22": {
      "allOf": [
        {
          "$ref": "#/definitions/LocalizedText"
        }
      ]
    },
    "__schema23": {
      "allOf": [
        {
          "$ref": "#/definitions/LocalizedText"
        }
      ]
    },
    "__schema24": {
      "allOf": [
        {
          "$ref": "#/definitions/LocalizedText"
        }
      ]
    },
    "__schema25": {
      "type": "string"
    },
    "__schema26": {
      "type": "string"
    },
    "__schema27": {
      "type": "array",
      "items": {
        "type": "string",
        "pattern": "^tm_[0123456789abcdefghjkmnpqrstvwxyz]{8}$"
      }
    },
    "__schema28": {
      "type": "array",
      "items": {
        "type": "object",
        "properties": {
          "story": {
            "type": "string",
            "pattern": "^story_[0123456789abcdefghjkmnpqrstvwxyz]{6}$"
          },
          "step": {
            "type": "string",
            "pattern": "^st_[0123456789abcdefghjkmnpqrstvwxyz]{6}$"
          }
        },
        "required": [
          "story",
          "step"
        ],
        "additionalProperties": false
      }
    },
    "__schema29": {
      "type": "object",
      "properties": {
        "levelId": {
          "type": "string",
          "pattern": "^lv_[0123456789abcdefghjkmnpqrstvwxyz]{8}$"
        }
      },
      "required": [
        "levelId"
      ],
      "additionalProperties": false
    }
  }
}
