{
  "id": "tm_qpw1px47",
  "rev": 1,
  "revKind": "text",
  "status": "draft",
  "category": "ratio",
  "label": { "zh-TW": "資本公積÷股本", "en": "Capital surplus to share capital ratio" },
  "teacherLabel": "資本公積÷股本",
  "currentTwLabel": "資本公積÷股本",
  "ifrsEnglish": null,
  "aliases": { "zh-TW": ["資本公積占股本比率"], "en": [] },
  "flags": [],
  "confidence": "high",
  "pendingRefs": ["T17"],
  "note": { "zh-TW": "老師自訂的比率，非標準指標（T17），不計分。", "en": "A teacher-defined ratio rather than a standard one (T17); not scored." },
  "definition": { "zh-TW": "資本公積相對於股本的比率，看股東投入超過面額的部分有多少。", "en": "Capital surplus relative to share capital: how much the shareholders contributed above par value." },
  "ifrsNote": {
    "zh-TW": "IFRS 不定義財務比率；這個名稱是國際通用說法，計算口徑以指標登錄檔的版本為準。",
    "en": "IFRS does not define financial ratios. The name follows international usage; the calculation basis is the version in the ratio registry."
  },
  "ratioRef": "capital_surplus_to_share_capital@slides02"
}
